{
  "schema_version": "0.1",

  "project": {
    "id": "project_001",
    "name": "Phase 0 Test",
    "unit": "mm",
    "coordinate_system": "z_up",
    "default_wall_thickness": 240
  },

  "buildings": [
    {
      "id": "building_001",
      "name": "Main Building",
      "storeys": [
        {
          "id": "storey_01",
          "name": "Ground Floor",
          "elevation": 0,
          "height": 3300,
          "elements": [
            {
              "id": "wall_001",
              "type": "wall",
              "storey_id": "storey_01",
              "geometry": {
                "baseline": [
                  [0, 0, 0],
                  [10000, 0, 0]
                ],
                "height": 3300,
                "thickness": 240
              },
              "semantic": {
                "exterior": true
              },
              "opening_ids": [
                "window_001",
                "window_002",
                "window_003",
                "window_004",
                "door_001"
              ],
              "confidence": 1.0
            }
          ]
        }
      ]
    }
  ],

  "openings": [
    {
      "id": "window_001",
      "type": "window",
      "parent_id": "wall_001",
      "geometry": {
        "offset": 500,
        "sill_height": 900,
        "width": 1500,
        "height": 1500,
        "depth": 240
      },
      "component": {
        "definition_id": "window_standard_1500"
      },
      "confidence": 1.0
    },
    {
      "id": "window_002",
      "type": "window",
      "parent_id": "wall_001",
      "geometry": {
        "offset": 2500,
        "sill_height": 900,
        "width": 1500,
        "height": 1500,
        "depth": 240
      },
      "component": {
        "definition_id": "window_standard_1500"
      },
      "confidence": 1.0
    },
    {
      "id": "window_003",
      "type": "window",
      "parent_id": "wall_001",
      "geometry": {
        "offset": 4500,
        "sill_height": 900,
        "width": 1500,
        "height": 1500,
        "depth": 240
      },
      "component": {
        "definition_id": "window_standard_1500"
      },
      "confidence": 1.0
    },
    {
      "id": "window_004",
      "type": "window",
      "parent_id": "wall_001",
      "geometry": {
        "offset": 6500,
        "sill_height": 900,
        "width": 1500,
        "height": 1500,
        "depth": 240
      },
      "component": {
        "definition_id": "window_standard_1500"
      },
      "confidence": 1.0
    },
    {
      "id": "door_001",
      "type": "door",
      "parent_id": "wall_001",
      "geometry": {
        "offset": 8500,
        "width": 900,
        "height": 2100,
        "depth": 240
      },
      "component": {
        "definition_id": "door_standard_900"
      },
      "confidence": 1.0
    }
  ],

  "components": [
    {
      "id": "window_standard_1500",
      "type": "window",
      "parameters": {
        "width": 1500,
        "height": 1500
      }
    },
    {
      "id": "door_standard_900",
      "type": "door",
      "parameters": {
        "width": 900,
        "height": 2100
      }
    }
  ],

  "constraints": [
    {
      "id": "constraint_001",
      "type": "equal_width",
      "targets": [
        "window_001",
        "window_002",
        "window_003",
        "window_004"
      ],
      "priority": "hard"
    }
  ],

  "sources": []
}
